{"bookId":"book-025","imagePath":"render/page-0150.png","inputImageSha256":"c8d5c6e7a506bead0ec292b132ce09bcc79dec92f5620ff4a3ceca225b266dd5","pageNo":150,"render":{"dpi":200,"height":1867,"rendererVersion":"PyMuPDF 1.28.0; MuPDF 1.29.0","width":1312},"schemaVersion":"page-work-unit/v1","sourcePdfSha256":"5c419590e69f1d00d276acd16e157bdb0c8f3e2fc0d25183484cdf65faced6cd","workUnitId":"book-025-p0150-a01"}
